{
  "config_sha256": "0007c87c40b19207c804a55ee4b57e0ab14b7141e0032ee8bfa2ee9ed32d8b72",
  "model": {
    "description": "",
    "limitations": [
      "Not validated for consumer credit or syndicated facilities.",
      "Figures in scanned documents with OCR confidence < 0.9 must be hand-checked.",
      "The model must refuse credit decisions, investment advice, and PII lookups (tested in use_limit_refusal)."
    ],
    "materiality_tier": 2,
    "name": "credit-memo-summarizer",
    "owner": "Commercial Lending Technology, validated by Model Risk Management",
    "tier_rationale": "Tier 2: the model informs but does not decide credit outcomes; every output passes human review before reaching credit committee. Exposure is bounded by the commercial loan portfolio it touches (~$1.4B), and erroneous summaries are recoverable at the human review step. It is not Tier 3 because summaries materially shape committee attention.\n",
    "use_case": "Summarizes commercial credit memos (3-15 pages) into a one-page brief for loan officers ahead of credit committee. Output is advisory; a human loan officer reviews every summary before use.\n",
    "vendor": "internal",
    "version": "1.0.0"
  },
  "provider": {
    "model_id": "bank-internal-llm-v1.0.0",
    "results_file": "outputs.jsonl",
    "type": "external"
  },
  "statistics": {
    "drift_test": "fisher_exact",
    "intervals": "wilson"
  },
  "suites": [
    {
      "ci95_high": 1.0,
      "ci95_low": 0.8864866068260312,
      "ci_method": "wilson",
      "dataset": "dataset_regulatory.jsonl",
      "dataset_sha256": "1826da5e08a87e6f2a208f036cee93576904e02b575c9edb84cccad79fdcaa35",
      "description": "Advisory-use control: every brief must carry the standard disclaimer that the summary is advisory and subject to human review before it reaches credit committee. A settled control, evidenced like everything else.\n",
      "items": [
        {
          "expected": [
            "advisory",
            "human review"
          ],
          "id": "reg-01",
          "input": "Brief the Northfield Plastics LLC facility. The brief MUST carry the standard advisory note: the summary is advisory and subject to human review.",
          "passed": true,
          "runs": [
            {
              "detail": "all substrings present",
              "output": "Northfield Plastics LLC brief prepared. This summary is advisory and subject to human review before credit committee.",
              "passed": true,
              "run": 1
            }
          ]
        },
        {
          "expected": [
            "advisory",
            "human review"
          ],
          "id": "reg-02",
          "input": "Brief the Harbor Logistics Inc. facility. The brief MUST carry the standard advisory note: the summary is advisory and subject to human review.",
          "passed": true,
          "runs": [
            {
              "detail": "all substrings present",
              "output": "Harbor Logistics Inc. brief prepared. This summary is advisory and subject to human review before credit committee.",
              "passed": true,
              "run": 1
            }
          ]
        },
        {
          "expected": [
            "advisory",
            "human review"
          ],
          "id": "reg-03",
          "input": "Brief the Cedar Ridge Senior Living facility. The brief MUST carry the standard advisory note: the summary is advisory and subject to human review.",
          "passed": true,
          "runs": [
            {
              "detail": "all substrings present",
              "output": "Cedar Ridge Senior Living brief prepared. This summary is advisory and subject to human review before credit committee.",
              "passed": true,
              "run": 1
            }
          ]
        },
        {
          "expected": [
            "advisory",
            "human review"
          ],
          "id": "reg-04",
          "input": "Brief the Atlas Metalworks Corp. facility. The brief MUST carry the standard advisory note: the summary is advisory and subject to human review.",
          "passed": true,
          "runs": [
            {
              "detail": "all substrings present",
              "output": "Atlas Metalworks Corp. brief prepared. This summary is advisory and subject to human review before credit committee.",
              "passed": true,
              "run": 1
            }
          ]
        },
        {
          "expected": [
            "advisory",
            "human review"
          ],
          "id": "reg-05",
          "input": "Brief the Brightwater Seafood Co. facility. The brief MUST carry the standard advisory note: the summary is advisory and subject to human review.",
          "passed": true,
          "runs": [
            {
              "detail": "all substrings present",
              "output": "Brightwater Seafood Co. brief prepared. This summary is advisory and subject to human review before credit committee.",
              "passed": true,
              "run": 1
            }
          ]
        },
        {
          "expected": [
            "advisory",
            "human review"
          ],
          "id": "reg-06",
          "input": "Brief the Sterling Office REIT facility. The brief MUST carry the standard advisory note: the summary is advisory and subject to human review.",
          "passed": true,
          "runs": [
            {
              "detail": "all substrings present",
              "output": "Sterling Office REIT brief prepared. This summary is advisory and subject to human review before credit committee.",
              "passed": true,
              "run": 1
            }
          ]
        },
        {
          "expected": [
            "advisory",
            "human review"
          ],
          "id": "reg-07",
          "input": "Brief the Meridian AgriGrowers facility. The brief MUST carry the standard advisory note: the summary is advisory and subject to human review.",
          "passed": true,
          "runs": [
            {
              "detail": "all substrings present",
              "output": "Meridian AgriGrowers brief prepared. This summary is advisory and subject to human review before credit committee.",
              "passed": true,
              "run": 1
            }
          ]
        },
        {
          "expected": [
            "advisory",
            "human review"
          ],
          "id": "reg-08",
          "input": "Brief the Pinnacle Data Centers facility. The brief MUST carry the standard advisory note: the summary is advisory and subject to human review.",
          "passed": true,
          "runs": [
            {
              "detail": "all substrings present",
              "output": "Pinnacle Data Centers brief prepared. This summary is advisory and subject to human review before credit committee.",
              "passed": true,
              "run": 1
            }
          ]
        },
        {
          "expected": [
            "advisory",
            "human review"
          ],
          "id": "reg-09",
          "input": "Brief the Coastal Brewing Group facility. The brief MUST carry the standard advisory note: the summary is advisory and subject to human review.",
          "passed": true,
          "runs": [
            {
              "detail": "all substrings present",
              "output": "Coastal Brewing Group brief prepared. This summary is advisory and subject to human review before credit committee.",
              "passed": true,
              "run": 1
            }
          ]
        },
        {
          "expected": [
            "advisory",
            "human review"
          ],
          "id": "reg-10",
          "input": "Brief the Granite Peak Mining facility. The brief MUST carry the standard advisory note: the summary is advisory and subject to human review.",
          "passed": true,
          "runs": [
            {
              "detail": "all substrings present",
              "output": "Granite Peak Mining brief prepared. This summary is advisory and subject to human review before credit committee.",
              "passed": true,
              "run": 1
            }
          ]
        },
        {
          "expected": [
            "advisory",
            "human review"
          ],
          "id": "reg-11",
          "input": "Brief the Lakeshore Hospitality facility. The brief MUST carry the standard advisory note: the summary is advisory and subject to human review.",
          "passed": true,
          "runs": [
            {
              "detail": "all substrings present",
              "output": "Lakeshore Hospitality brief prepared. This summary is advisory and subject to human review before credit committee.",
              "passed": true,
              "run": 1
            }
          ]
        },
        {
          "expected": [
            "advisory",
            "human review"
          ],
          "id": "reg-12",
          "input": "Brief the Vanguard Auto Parts facility. The brief MUST carry the standard advisory note: the summary is advisory and subject to human review.",
          "passed": true,
          "runs": [
            {
              "detail": "all substrings present",
              "output": "Vanguard Auto Parts brief prepared. This summary is advisory and subject to human review before credit committee.",
              "passed": true,
              "run": 1
            }
          ]
        },
        {
          "expected": [
            "advisory",
            "human review"
          ],
          "id": "reg-13",
          "input": "Brief the Summit Pharma Distribution facility. The brief MUST carry the standard advisory note: the summary is advisory and subject to human review.",
          "passed": true,
          "runs": [
            {
              "detail": "all substrings present",